{
  "meta": {
    "template_path": "./template.pptx",
    "output_path": "./demo_output.pptx",
    "figs_dir": "./figs",
    "template_slide_indices": { "cover": 0, "toc": 1, "sections": [2,3,4,5], "thanks": 7 }
  },
  "cover": {
    "title_en": "Attention Is All You Need",
    "presenter": "xxx",
    "date": "202X年X月"
  },
  "toc_replacements": {},
  "section_divider_edits": [
    { "number": "01", "title": "作者团队" },
    { "number": "02", "title": "课题背景" },
    { "number": "03", "title": "结果分析" },
    { "number": "04", "title": "讨论" }
  ],
  "slides": [
    { "type": "keep", "ref": "cover" },
    { "type": "keep", "ref": "toc" },
    { "type": "keep", "ref": "section", "index": 0 },
    {
      "type": "author",
      "journal": { "name": "NeurIPS", "if": "2017", "doi": "10.48550/arXiv.1706.03762", "date": "2017年" },
      "institutions": ["Google Research", "Google Brain"],
      "authors": "Ashish Vaswani | Noam Shazeer | Niki Parmar | Jakob Uszkoreit | Llion Jones | Aidan N. Gomez | Lukasz Kaiser | Illia Polosukhin",
      "prior_work": ["2014: Seq2Seq + Attention (Bahdanau et al., ICLR 2015)", "2016: ByteNet / ConvS2S (CNN for seq2seq)", "2017: Transformer — 第一个纯注意力机制的序列转换模型"]
    },
    { "type": "keep", "ref": "section", "index": 1 },
    {
      "type": "background",
      "cards": [
        { "title": "序列建模困境", "body": "RNN/LSTM 逐词串行处理\n无法并行化训练\n长距离依赖衰减严重\n\nCNN 可并行但感受野受限", "color": "red_accent" },
        { "title": "核心创新", "body": "完全抛弃循环和卷积\n提出 Self-Attention 机制\n每个词直接关注所有词\n全局依赖 O(1) 路径长度\n可完全并行训练", "color": "gold" },
        { "title": "Transformer 方案", "body": "Encoder-Decoder 架构\nMulti-Head Attention (8头)\nPositional Encoding\nResidual + LayerNorm\n训练速度快 10-100 倍", "color": "teal" }
      ],
      "hypothesis": "Self-Attention 替代循环/卷积 → 全局并行 + 短路径 → 更好捕捉长程依赖 → 机器翻译新SOTA",
      "experiment": "WMT 2014 EN-DE (4.5M句对) + EN-FR (36M句对) × 8 P100 GPU × 12小时(Base) / 3.5天(Big)"
    },
    { "type": "keep", "ref": "section", "index": 2 },
    {
      "type": "result",
      "title": "3.1 Transformer 模型架构：Encoder-Decoder 栈",
      "body": ["6层Encoder（Self-Attn + FFN）+ 6层Decoder（Self + Cross + FFN）", "Multi-Head Attention 允许模型同时关注不同表示子空间", "Positional Encoding 注入序列位置信息，无需循环结构"],
      "images": [{ "file": "1A.jpg", "top_in": 1.05 }, { "file": "1DEF.jpg", "top_in": 3.85 }]
    },
    {
      "type": "result",
      "title": "3.2 机器翻译性能：BLEU 新纪录",
      "body": ["Transformer Big 在 EN-DE 达 28.4 BLEU，EN-FR 达 41.8 BLEU", "超越此前所有模型（ByteNet、ConvS2S、GNMT+RL）", "训练成本仅为同类模型的 1/3~1/5 FLOPs"],
      "images": [{ "file": "2A.jpg", "top_in": 1.05 }, { "file": "2BC.jpg", "top_in": 3.85 }]
    },
    {
      "type": "result",
      "title": "3.3 消融实验：Attention 组件的关键贡献",
      "body": ["减少注意力头数(h=1)导致性能显著下降(4.5→5.2 PPL)", "增大头数至16或32时性能饱和，8头是最优平衡点", "移除 Positional Encoding 导致性能急剧恶化(4.5→6.0)"],
      "images": [{ "file": "2DE.jpg", "top_in": 1.05 }, { "file": "2FG.jpg", "top_in": 3.85 }]
    },
    {
      "type": "summary",
      "title": "3.4 研究总结：Transformer 的革命性贡献",
      "flow_steps": [
        { "text": "序列建模\n瓶颈", "color": "red_accent" },
        { "text": "Self-Attention\n机制", "color": "gold" },
        { "text": "Multi-Head\n并行化", "color": "teal" },
        { "text": "Encoder-Decoder\n架构", "color": "blue_slate" },
        { "text": "BLEU\n新纪录", "color": "blue_deep" },
        { "text": "NLP领域\n范式转变", "color": "navy" }
      ],
      "evidence_cards": [
        { "title": "性能证据", "detail": "EN-DE 28.4 BLEU, EN-FR 41.8 BLEU, 均超越此前所有模型" },
        { "title": "效率证据", "detail": "训练FLOPs仅为ConvS2S的1/3, 可完全并行化, 12h训练(Base)" },
        { "title": "影响力证据", "detail": "催生了BERT/GPT/T5/LLaMA等所有后续预训练模型架构" }
      ],
      "conclusions": ["Transformer 首次证明纯注意力机制可以完全替代循环和卷积进行序列转换", "Multi-Head Self-Attention 提供了全局并行、短路径、可解释的建模能力", "该架构成为NLP乃至整个AI领域的基础设施, 催生了GPT/BERT等预训练大模型时代"]
    },
    { "type": "keep", "ref": "section", "index": 3 },
    {
      "type": "discussion1",
      "title": "4 讨论：Transformer 为何成功",
      "items": [
        { "number": "1", "title": "全局注意力 vs 局部感受野", "detail": "Transformer 每层每个位置直接关注所有位置(O(1)路径长度), RNN需O(n)步传递信息, CNN感受野受核大小限制。这种全局建模能力是Transformer优于RNN/CNN的根本原因" },
        { "number": "2", "title": "Multi-Head 的表示学习", "detail": "8个注意力头各自学习不同的注意力模式(句法/语义/指代), 拼接后经线性变换融合。消融实验表明减少头数显著降低性能, 而增加头数收益递减" },
        { "number": "3", "title": "训练效率的工程价值", "detail": "完全并行化意味着训练时间从周级缩短到小时级, 使更大规模实验成为可能。这一效率优势直接推动了后续GPT/BERT等大规模预训练模型的发展" }
      ]
    },
    {
      "type": "discussion2",
      "title": "4 局限性与未来方向",
      "left_title": "局限性",
      "left_items": ["1. Self-Attention 复杂度 O(n²), 长序列效率低", "2. 位置编码为固定正弦函数, 缺乏可学习性", "3. 仅验证了机器翻译任务, 泛化性未知", "4. 训练数据规模较小(WMT), 扩展性待验证", "5. 注意力权重可解释性有限, 存在冗余头"],
      "right_title": "影响与未来方向",
      "right_items": ["后续影响:", "·  BERT (2018): 双向Transformer编码器", "·  GPT (2018+): 自回归Transformer解码器", "·  T5 / BART: Encoder-Decoder统一框架", "·  ViT (2020): Transformer进入计算机视觉", "", "本文已成为AI领域引用量最高的论文之一(10万+)"]
    },
    { "type": "keep", "ref": "thanks" }
  ]
}
